Двойка Воды,"гармоничное партнерство; прочные любовные отношения; сердечная связь двух душ","Со мной рядом тот, с кем мы находимся в гармонии. Вместе мы идем по настоящему и придумываем будущее, мы знаем, кто мы друг для друга. Два сердца бьются как одно, мы дополняем и вдохновляем друг друга. У меня есть тот, кто пробуждает лучшее во мне, и я могу сделать то же самое для другой души, ибо все мы — воплощения божественной любви."
Тройка Воды,"празднество; наслаждение общением; делиться с другими; изобилие; командный дух; общая цель; дружба","Радость и волнение переполняют собравшихся вместе. Я готов стать частью чего-то большего, чем я сам. Время, чтобы радоваться товариществу, чувствовать единство. Мы. поддерживаем друг друга, играем в одной команде, созидаем сообща. Мы друзья, семья и товарищи, мы делимся своим опытом. Время вспомнить о том, что мы должны принимать друг друга такими, какие мы есть, с нашими темными и светлыми сторонами."
Четвёрка Воды,"сновидение и самоанализ; созерцание; вера в наличие возможностей","Временное затишье предоставляет мне возможность чаще, чем прежде, предаваться мечтам. Даже если мои планы не реализуются, я ощущаю себя в безопасности, зная, что меня ожидает нечто большее. Вселенная строит свои замыслы в моих интересах, я с легкостью отпускаю разочарование и печаль. Я полагаюсь на Дух, обладающий многими способами ответить на мои желания; то, что я ищу, может принимать различные формы. Я верю в то, что придут идеальное время и божественный порядок."
Пятёрка Воды,"высвобождение горя; позволить печали нахлынуть и отступить, прощение; прилив и отлив эмоций","Я ощущаю полноту своих эмоций, когда они захлестывают меня. Превратности судьбы являются неотъемлемой частью жизни. Я полностью прощаю себя и других, отказываюсь от эмоций, которые сдерживали меня от осознания правды. Я становлюсь свободен, когда отпускаю то, что более не служит мне. Я возмещаю ущерб тем, кому, возможно, навредил, когда эмоции влияли на мое восприятие. Я препоручаю все свои обиды божественному, зная, что они могут быть превращены в чудеса. Бесстрашие ведет к освобождению."
Шестёрка Воды,"ностальгия; сладкие воспоминания; отзвуки былого; стремление к безопасности старых добрых дней","Вспоминая о прошлом, я наслаждаюсь теплыми воспоминаниями, но должен признать, что они эфемерны. Эмоции могут повлиять на мою реакцию и исказить мое понимание того, что происходит на сегодняшний день. Я признаю наличие старых ран и лечу их. Я нахожусь в безопасности не только в прошлом, но и в настоящем, потому что меня окутывает божественная любовь. Нет необходимости обращаться к иллмюзии минувшего золотого века — я могу начать созидание лучшей реальности прямо сейчас. Я обрету подлинные исцеление и радость, если прекращу вновь и вновь переживать эмоции прошлого."
Семёрка Воды,"воображение; фантазия; творческие начинания; высвобождение способностей к созиданию","Время настроиться на существующие бесконечные возможности и начать их использовать. Все берет свое начало в мире воображения, поэтому я мечтаю. Я позволяю интуиции и желанию алхимически соединиться для того, чтобы создать что-то новое. Воздушные замки могут обрести твердое основание, если я перестану быть жестким, научусь обходить правила и стану более гибким и открытым. Ограничения сняты, границы распахнуты. Дух никогда не сомневается в силе, и я тоже!"
Восьмёрка Воды,"путь к инициации; отпустить иллюзии для того, чтобы обрести нечто подлинное; за гранью внешнего","Не все то золото, что блестит. Я знаю, что достоин подлинных богатств, такого «золота», которое наполнит меня радостью, изобилием и пониманием. Я без страха останавливаюсь на полдороге и пересматриваю то, где я был, где я нахожусь сейчас и куда я могу пойти. Теперь я уверенно выбираю правильный путь, несмотря на то, что другая дорога кажется мне более привлекательной, — я чувствую, куда должен идти. Я верен своему сердцу. Я зашел так далеко, как только смог, и оставил на обочине осколки иллюзий, последние остатки страха и стьыда. Я больше не буду держаться за то, что мне не подходит."
Девятка Воды,"мечта сбылась; желания исполнились; завершение; наслаждение; удовлетворение; достижение желаемого","Отказ от того, что мне не подходит, является правильной стратегией. Время исполнения желаний. Семена, которые я посадил, дали обильный урожай. Я упоен ароматом успеха, горд тем, как потрудился, и тем, чего достиг. Я наслаждаюсь удовлетворением от хорошо проделанной работы. Я принимаю с радостью заслуженный отдых и признание всего, что мною создано."
Десятка Воды,"спокойствие; мир; удача; благополучие","С миром и со мной все в порядке. Благополучие — мое естественное состояние. Все, что мне нужно, приходит ко мне легко и без усилий. Я чубствую радость и делюсь ею с другими. Я безмятежен, я знаю, чего мне стоило добиться того, чего я достиг. Я праздную свои достижения и достижения тех, кто прошел этот путь со мной, и благодарен Духу за то, что он всегда был моим спутником."
Паж Воды,"открытость; детская невинность и любопытство; начало близости и отношений; игривость; веселый оптимизм","Я раскрываю сердце, позволяя себе быть по-детски невинным и ожидать чуда. Все приключения ведут именно туда, куда мне нужно. Любовь ждет! Жизнь — это восхитительный танец, и я здесь для того, чтобы резвиться и играть. Я готов к балу и радостно улыбаюсь."
Вестник Воды,"романтическое увлечение; рыцарство; видеть лучшее в других; повышенная осознанность эмоций; призыв влюбиться в себя","Мне следует видеть лучшее в других и относиться к ним с уважением даже тогда, когда это кажется трудным. Я привлекателен для других, поскольку люблю себя и знаю, что я — одна из многих частей любви, каждая из которых по-своему совершенна. Я могу иметь то, что хочу. Нет никакой необходимости в ревности, гневе, обиде или страхе, когда я люблю и мюбовь моя сильна."
Королева Воды,"сострадание; эмоциональная безопасность; щедрость; любовь к себе и забота о себе; целитель","Мне комфортно быть самим собой. Я люблю, берегу и лелею себя. Я свой собственный лучший друг. Взаимоотношения с другими людьми отражают мою уверенность в том, что я всегда достоин любви и уважения. Я исцеляю себя, мое сострадание может вдохновить других. Я способен сам нести миру перемены."
Король Воды,"щедрый; дипломатичный; справедливый; бережный; хороший слушатель; посредник","Я отношусь с уважением ко всем, включая самого себя. Я вижу, что у нас всех есть общие черты и Дух присутствует в каждом из нас. Я выслушиваю других и рассматриваю их точку зрения наравне с собственной прежде, чем принять решение или начать действовать. Я бережно и с любовью оберегаю других и веду их к гармоничному сотрудничеству."
Туз Огня,"действие под влиянием Духа; вдохновение к изменению, доступ к созидательной силе","Я вижу неограниченный потенциал для изменения, когда чувствую свою связь с Духом. Нет причин для страха, потому что меня поддерживают и благословляют на то, чтобы я представил и воплотил нечто новое. Время мечтать. Я могу быть смелым и свободным, потому что Дух вдохновляет меня претворять мечты в реальность."
Двойка Огня,"творческие планы на будущее; план вашего роста; доверие к неизвестному; вдохновленные Духом амбиции","Даже если мои мечты не становятся реальностью, я увлечен процессом созидания и придумыванием нового. Я уже добился определенных улучшений, и скоро мне представится идеальная для меня возможность. Свет Духа помогает различить свой путь и почувствовать, что Вселенная расположена даровать мне необходимое."
Тройка Огня,"расширение возможностей; полнота творчества; достижение","Я на верном пути к успеху. Передо мной множество возможностей. Я должен доверять себе, ибо я могу совершать правильный выбор и создавать такие ситуации и отношения, которые гармонируют с желанием моего сердца."
Четвёрка Огня,"новый этап вашего творчества; праздник и удовольствие; радость гармонии","Танцоры выступают парами, певцам аккомпанируют музыканты, я же нахожу тех, кто разделит со мной мои желания. Время праздновать дружбу и все то, что другие люди привносят в мою жизнь. Время веселиться и наслаждаться хорошей компанией. Вместе с другими людьми я создаю магию."
Пятёрка Огня,"мозговой штурм; единство в разнообразии; уважение различий","Я могу экспериментировать с самыми безумными идеями. То, что кажется сумасбродным сегодня, завтра окажется блестящим решением. Как ребенок, поверяющий сбвои фантазии товарищу по играм, я открыт новым людям и новым идеям, меня привлекает все необычное и незнакомое. Время парадоксов, оценки сумасшедших идей и того, что они могут принести."
Шестёрка Огня,"шагнуть в центр внимания; быть маяком; просвещенное влияние","Изменения, произошедшие со мной, так впечатляющи, что другие люди вдохновляются ими. Я возжег на вершине холма светильник, освещающий другим поиск их собственного пути. Я помию о темноте, людских бедах и о тех, кто греется в теплом свете высшего знания. Я благословляю их, но не приглушаю яркость своего маяка. Время обрести уверенность в том, что я способствую высшему благу особым способом."
Семёрка Огня,"личный рекорд; настойчивость; инакомыслие","Меня невозможно остановить. Моя настойчивость преодолевает все препятствия. Я умею подчиняться, но не иду на компромисс в том, что наиболее важно для меня. Даже если другие недовольны моим выбором, я продолжаю идти своим путем. Я разрешаю себе сопротивляться трудностям и верю, что могу многое свершить, если буду жить по своим правилам. Решения, вдохновленные свыше, являют себя."
Восьмёрка Огня,"наращивание темпа; празднование кардинальных перемен; путешествие; трансформация","Инерция движения возрастает, в то время как сила Духа питает перемены. Я на пути к неизведанному и готов принять все, что мне предложат. Я прибыл в пункт назначения, и мои открытия заряжают меня энергией."
Девятка Огня,"предосторожность; средоточие неопределенности; переоценка обстоятельств","Мне нужно остановиться, подождать и осмотреться вокруг прежде, чем продолжать движение. Я нахожусь в подвешенном состоянии — моя внутренняя мудрость говорит о необходимости ясно осознать ситуацию перед тем, как сделать следующий шаг. Задавать вопросы — это верная тактика! Мне следует быть внимательным, потому что сейчас совсем иной путь может оказаться верным."
Десятка Огня,"выгорание; избавление от излишков; конец расчищает дорогу началу","Возможно, я взял на себя слишком много. Сейчас я расстаюсь со старым хламом, как бы хорошо он мне ни послужил и каким бы полезным ни мог быть и впредь. Былая ценность вещей не означает, что мне следует за них цепляться в настоящем. Я отпускаю эмоции, отношения и события, которые более не актуальны для меня, — я рад, что все это было со мной, но настало время распрощаться."
Паж Огня,"действия, полные энтузиазма; склонность к авантюрам; рискованные шаги; начало проекта; действие в соответствии с новой идеей","Я могу рисковать, это мое право — созидать свою жизнь в соответствии со своими желаниями. Я обретаю цель, когда делаю первый шаг к чему-то новому. Мои идеи имеют ценность. Я смею мечтать!"
Вестник Огня,"новое приключение предопределено; приверженность к новшествам; самостоятельная творческая деятельность; делай «по-моему»; своевольный и энергичный","Мой дух непоколебим, и я могу создать все, что пожелаю. Я обновляюсь. Дух вокруг меня, и мудрость моя возрастает. Я действую в соответствии со своим видением ситуации и остаюсь верным тому, что я больше всего ценю и желаю, чем бы это ни было."
Королева Огня,"творческое сотрудничество; душевная связь; страсть, вдохновленная Духом; художник","Я способен на крепкие дружеские отношения, которые вдохновляют меня к самовыражению на собственный лад. Я сотрудничаю с другими, сосредоточившись на понимании того, как достичь наивысшего блага для всех. Как мне присоединиться к танцу сотворчества? Как позволить Духу вдохновить меня к выражению собственных страстей?"
Король Огня,"вдохновляющий провидец; духовный наставник; творческое лидерство","Единый с Духом я — могущественный лидер, вдохновляющий других. Когда я учу других людей и показываю им, к чему стремиться, мое мастерство приносит им пользу. Как мне сохранить веру в свои силы и собственное понимание ситуации, но при этом не закоснеть и остаться восприимчивым к новым идеям?"
Туз Воздуха,"судьба и рок; закон кармы; работа могущественной силы трансформации; синхронность","Моя жизнь находится под влиянием стечений обстоятельств и сил, находящихся за пределами моего контроля, и это только во благо! Все происходит очень быстро. Я могу ожидать быстрых результатов, продвижения вперед, умножения знаний."
Двойка Воздуха,"тупик; неопределенность; варианты","Время сделать перерыв, чтобы рассмотреть имеющиеся варианты и спокойно поразмыслить. Не нужно спешить. Мне будет ниспослан наполненный благом совет, если только я не буду торопиться и успокоюсь."
Тройка Воздуха,"проблеск надежды; естественный исход; «нет худа без добра»","Другой человек помогает мне увидеть ситуацию в истинном свете. То, что действительно мое, от меня никуда не денется. Дух срывает мои планы, тем самым защищая меня, — нужно дать свершиться переменам, чтобы на место старого пришло нечто новое и лучшее. Высшее благо заключается в умении увидеть настоящее положение вещей независимо от того, что оно причиняет мне временный дискомфорт."
Четвёрка Воздуха,"исцеление; медитация; отдых; восстановление сил","Пришло время дать отдохнуть разуму, позволить миру и спокойствию воцариться на месте суеты и скуки. Ум нуждается в покое, чтобы обрести ясность мысли. Я лучше пойму ситуацию, а мой разум станет острее, если я сделаю перерыв. Мне следует позаботиться о себе."
Пятёрка Воздуха,"напряженность; конфликт","Конфликт является хорошим способом осознать свои мотивы и намерения. Этот опыт можно использовать для того, чтобы приблизиться к моему истинному «я». Победа не является целью; цель — оставаться справедливым. Другие люди мыслят иным образом и могут не всегда соглашаться со мной. Я живу сам и даю жить другим."
Шестёрка Воздуха,"обряд посвящения; изменение пути; я мыслю так, как если бы обрел мудрость","Волны бушуют. Я верю, что достижение внутреннего покоя влечет за собой покой во внешних обстоятельствах. Я готов к ожидающим меня неприятностям — теперь я мыслю иначе, чем прежде, и верю в то, что дорога в неизведанное приведет меня к моим истинным желаниям. Я на пути к чему-то лучшему."
