Семёрка Воздуха,"независимость; несогласие; жить по своим правилам, не удовлетворяя чужие ожидания","Пришло время зажить по своим правилам, так что мне следует набраться мужества и отказаться соответствовать чужим ожиданиям. Мое стремление к независимости помогает отринуть навязанные мне ценности и заняться собственными потребностями. Дипломатичность способствует тому, чтобы я оставался верным своему намерению и действовал во имя своих интересов."
Восьмёрка Воздуха,"отказ от отрицания; видеть вещи такими, какие они есть; ясность","Я доверяюсь Духу и вижу все так, как оно есть на самом деле. Лишиться иллюзий — значит освободиться от заблуждений, сдерживающих мой рост и возможности самоисцеления. Поэтому я решаю распрощаться с иллюзиями, которые затуманили мое зрение. Добросовестность придает мне сил и смелости встретить все лицом к лицу."
Девятка Воздуха,"переход от самоосуждения к состраданию самому себе; от страха к возможности; призыв к вере","Я успокаиваю себя: все будет хорошо, я в полном порядке, это мой страх искажает реальность. Я знаю, что делаю все, что в моих силах, и прощаю себя за неудачи. Я взываю к Духу и помню, что способен на многое и непременно добьюсь результата, как только мне представится для этого возможность."
Десятка Воздуха,"изящное завершение и новое начало; точка прозрения; конец старого мышления","Новое зарождается в старом. Я благодарен за преподнесенные судьбой уроки, освободившие меня от привычных шаблонов, и радуюсь любому исходу ситуации. Я отпускаю ситуацию и позволяю  ей завершиться, поскольку знаю, что нечто лучшее может явиться в любой момент. Я признателен тому, что отныне могу по-разному реагировать на любые сложности."
Паж Воздуха,"новые идеи; еще не доказанная теория; любопытство; взгляд с другой точки","Это нужно как следует изучить, а мы только прошлись по верхам. Я действительно этого не знаю. Это интересно! Чему я научусь, освоив этот способ мышления?"
Вестник Воздуха,"выводы, основанные на опыте; приверженность догмам; приобретенная реакция; программирование подсознания; быстрое реагирование","Мне следует смотреть на вещи шире. Я реагирую на ситуацию из своего прошлого. Мне придется подумать, хочу ли я действовать как раньше. Я могу приспособиться к новому образу мышления и поведения. Если я действую без промедления и думаю о высшем благе, то положительные результаты гарантированы."
Королева Воздуха,"установление здоровых границ; сильная самооценка; взвешенные и мудрые решения; четкое взаимодействие; хорошая организация; красноречие","Я обладаю ясным представлением о цели. Мои намерения согласуются с моим пониманием ситуации. В игре под названием «Жизнь» всегда есть стратегия. Могу ли я отречься от ложных истин и быть абсолютно честным с собой и другими?"
Король Воздуха,"власть разума; рассудок победил инстинкт; интеллект довлеет над страстью; успешные переговоры; правила; законы","Правда — это всё. Я думаю прежде, чем действовать. Я руководствуюсь универсальными законами и ясным намерением. Вижу ли я, как прошлое влияет на настоящее и будущее?"
