0 — Шут,энтузиазм,"Я знаю, что духовный подход редко согласуется с логикой и порой даже кажется непрактичным. Но когда появляется эта карта, я могу рискнуть, поверив, что возможно всё! Невидимые сферы будут открываться мне на каждом шагу, где бы я ни странствовал. Это время, когда я обретаю знание о том, что являюсь духовным существом с человеческим опытом."
I — Маг,алхимия,"Любые чудеса возможны, когда я нахожусь в согласии с волей Духа. Когда я вижу эту карту, то напоминаю себе, что моя воля и мастерство сами по себе дадут лишь ограниченные результаты. Если же я помню о своей взаимосвязи с Духом, все получается намного лучше. Мне нужно проанализировать свою готовность к созидательным алхимическим отношениям, и прекрасные результаты не заставят себя ждать. Через меня Дух творит магию."
II — Верховная Жрица,тайна,"Некоторые вещи не предназначены для постижения разумом, но могут быть познаны при помощи интуиции. Эта карта напоминает о вере в то, что у меня есть доступ к высшей мудрости, и дает знать, когда следует настроиться на волну и довериться своим чувствам. Время раскрытия тайн и — как результат — возможности личностного роста."
III — Императрица,плодородие,"Это прекрасный период для того, чтобы дать начало новым идеям и новому опыту. Я обязательно получу поддержку, как только начну обновление своего «я». Моя жизнь богата и полна возможностей, я созрел для того, чтобы проявлять себя и творить. Я — могущественный созидатель, и жизнь любит меня! Мой мир наполнен потенциалом и бесконечными перспективами, которые обязательно проявят себя во имя высшего блага."
IV — Император,власть,"Следовать правилам — вот что я должен делать прямо сейчас. Люди, обладающие властью, снисходят к моим устремлениям и дают мие хорошие советы, если я за ними обращаюсь. Эта карта говорит о твердой уверенности в ситуации. Благоприятное время для общения с такими структурами, как банки, органы власти, образовательные учреждения."
V — Первосвященник,духовная практика,"Эта карта напоминает о необходимости духовной практики, обеспечибающей осознанный контакт с моей высшей силой. Если я ежедневно молюсь и медитирую, выражаю свою благодарность и стремление созидать, то жизнь являет себя чудесными путями. Это время подходит для совершения ритуалов и обмена клятвами."
VI — Любовь,единство,"Сепарация — это только иллюзия. На самом деле мы все являемся отражениями друг друга. Принимая решения, я склонен рассматривать проблему категорично — или/или. Когда я начну видеть вещи цельными, все преисполнится магии. Любовь повсюду вокруг меня, Дух любит меня безусловно, и я сам способен давать и получать обильную любовь."
VII — Колесница,победа,"Настало время побед, к которым меня привели усердная работа и преодоление препятствий. Я научился воспринимать все происходящее в моей жизни как необходимое для моего роста. Я упал, но поднялся вновь, чтобы жить свободно, честно, бесстрашно и умело. "
VIII — Сила,стойкость,"Я могу пройти этот путь и знаю, что все происходит своевременно в соответствии с божественным предопределением. У меня есть мужество совершать чудеса. Доверяясь Духу, я становлюсь так силен, что могу свернуть горы и преодолеть любое препятствие в себе самом и вовне!"
IX — Отшельник,передышка,"Иногда нужно взять передышку для перегруппировки и самонаблюдения. Это временное состояние, необходимое для моего роста. В момент отступления и обновления у меня есть возможность ясно взглянуть на происходящее в моей жизни."
X — Колесо Фортуны,судьба и синхронность,"Я испытываю трепет перед совпадениями, доказывающими, что Дух покровительствует мне! Эти счастливые случайности, когда все само собой получается превосходно, демонстрируют, как тесно мы связаны. Если я положусь на творческое сотрудничество с Духом, то только выиграю. Моя судьба теперь очевидна."
XI — Правосудие,карма,"В игру вступил закон причины и следствия, стихии пришли к равновесию. Что посеешь, то и пожнешь. Мне явлены доказательства действия этого закона в условиях моего мира."
XII — Повешенный,поражение,"В это время следует быть готовым к самопожертвованию и поражению. Ничто в жизни не дается бесплатно, и ничто не происходит так, как я ожидаю. Эта карта в раскладе напоминает о том, что промедление может быть к лучшему; мне следует отдаться на волю Провидения, пока все само собой не сойдется должным образом. Настал момент для того, чтобы распрощаться со своими представлениями о том, как все должно быть. Меня призывают признать поражение и ожидать дальнейшего развития события."
XIII — Трансформация,изменение,"Ничто не остается неизменным, мне следует принять, что жизнь состоит из сменяющих друг друга циклов рождения, смерти и возрождения. Наступило время перемен. Во имя высшего блага я должен смириться с происходящим. Меня призывают отпустить старое, чтобы я смог приветствовать новое."
XIV — Терпение,умеренность,"Эта карта напоминает, что терпение приведет меня к пониманию и упорядочению собственных замыслов. Все мои потребности уже удовлетворены, даже если я пока не ощущаю этого. Ангел присматривает за мной. Прямо сейчас во всем необходима умеренность."
XV — Искушение,привязанность,"Материальный мир — площадка для моих игр, но мне следует быть осторожным и не придавать особого значения их результатам. Я предупрежден о том, что не следует выходить за пределы допустимого, и должен понимать, что представляет для меня опасность. Эта карта в раскладе символизирует, что я сосредоточен на материальном мире и должен отдавать себе отчет в опасности любых излишеств или дурных привычек — моих собственных либо чужих."
XVI — Башня,сюрпризы,"Перемены происходят быстрее, чем эта карта ложится на стол. Ее появление предвещает полную смену парадигмы или внезапный катаклизм, который освобождает место для чего-то лучшего. Она может символизировать прозрение. Как бы там ни было, карта говорит о том, что неожиданные события будут очень интересными и предоставят мне возможности для положительных перемен, при условии, что я не упущу их."
XVII — Звезда,вдохновение,"Я полон надежд и вдохновлен событиями, происходящими в моей жизни, они внушают мне ощущение поддержки свыше. После всех пережитых перемен я вижу, как впереди забрезжило новое начало."
XVIII — Луна,иллюзия,"Я могу не видеть, что именно делает Дух, но я знаю, что за кулисами нашей реальности происходит больше, чем кажется. Важно положиться на неведомое и помнить о том, что материальный мир является лишь иллюзией. Текущая ситуация не обязательно правдиво отражает истинную суть происходящего. Большие возможности скрываются в тени, ожидая идеального момента для того, чтобы явиться во всем своем великолепии."
XIX — Солнце,изобилие,"Настало время, когда возможно всё и все Знания, что мне необходимы, доступны. Задуманное принесло свои плоды, отношения развиваются, улучшения гарантированы. Это время изобилия. Важно, что я разделяю это изобилие с другими и испытываю за него глубокую благодарность."
XX — Зов,истинный успех,"У меня есть все необходимое для движения вперед к моей цели. Мое призвание — установить глубокие взаимоотношения с самим собой, своей Высшей Силой, и с другими людьми. Я нахожусь здесь по определенной причине. Я должен сделать шаг к своему настоящему «я». Мне следует верить, что моя жизнь имеет цель, что я «достаточно хорош для этого». Я воплощаю намерение Провидения, важное не только для меня самого."
XXI — Мир,ракурс,"Меня призывают пересмотреть взгляд на жизнь. Я перестаю испытывать страх, когда вспоминаю, что прежде всего являюсь бессмертной душой, переживающей человеческое бытие. Я знаю, что я — могущественный творец, находящийся в божественном партнерстве с Духом. Со мной в мир приходят чудеса, когда я пребываю в гармонии с Духом и не думаю об итоге."
Туз Земли,"благополучие в самом чистом виде, конкретные результаты в реальном мире, осязаемое изобилие","Я понимаю, что изобилие воплощается в великом множестве форм, и настраиваюсь на успех. Я превращаю в золото все ресурсы, которыми обладаю. Я влияю на ситуацию. Благополучие утверждается в материальном мире."
Двойка Земли,"работа в радость; гибкость; баланс между работой и досугом","Мой труд приносит мне радость. Я не разделяю работу и отдых, поскольку мне нравится то, чем я занимаюсь. Если условия вдруг изменятся, я смогу легко адаптироваться к ним. Я полон радости творчества и с нетерпением жду, когда семена, которые я посадил, прорастут и преподнесут мне свои сюрпризы. Настало время довериться Вселенной и грядущему. Так или иначе, мои мечты явят себя в этом мире."
Тройка Земли,"командная работа; прочный фундамент; коллективные усилия; объединение","У моих замков прочный фундамент, так что я могу быть уверенным в том, что они не рухнут. Другие люди помогают мне, мы совместно приняли решение о том, что будем создавать, и работаем вместе. Образ, который был в моих мечтах, становится осязаемым, и я делюсь этой радостью со своими партнерами и всеми, кто меня поддерживает. Все мы учимся, растем и строим сообща."
Четвёрка Земли,"собственность; красота божественного порядка; вера в надежность основания","Даже если мне не по себе и я не понимаю, почему все происходит именно так, я знаю, что божественный порядок присутствует во всех аспектах моей жизни. Мое здание построено на надежном основании, поэтому мне нечего бояться. Дух всегда рядом и напоминает мне, что я нахожусь там, где должен быть, и вокруг меня всегда изобилие."
Пятёрка Земли,"альтернативные формы изобилия; иллюзия  нехватки; незамеченные сокровища","Внешность бывает обманчива, поэтому стоит хорошо присмотреться. Смена ракурса может явить то, что я искал, хотя и не в том виде, что я ожидал. Меня призывают отказаться от психологии бедности и посмотреть на сокровища, которые я раньше не замечал и которые ныне стали мне доступны. Уходит иллюзия богатства и приходит осознание истинного изобилия. Не нужно бояться, что земля резко уйдет из-под ног. Я осознаю, что обладаю гораздо большим богатством, чем мне казалось; то, чему я уделяю внимание, будет прирастать. Я многого добился, воплощая свои замыслы, и меня ждут еще большие возможности."
Шестёрка Земли,"неожиданные ресурсы; приятные неожиданности; щедрость","То, что я отдал с любовью, вернется ко мне сторицей. Ресурсы приходят ко мне из неожиданных мест. Вселенная являет свою щедрость, показывая, что этот мир изобилует приятными сюрпризами. Внутри красивой обертки находится то, что мне сейчас нужно, — это дар от Духа. Как только я начал сомневаться, мне напомнили, что я достоин многих сокровищ. Какой подарок я разверну сегодня?"
Семёрка Земли,"возможность новой стратегии; перекресток; решение","Рассматривая свои достижения на текущий момент, я думаю о том, хочу ли я и дальше петь одну и ту же песню, или же стоит сменить пластинку. Я всегда могу вернуться к началу. Нет ничего страшного в том, чтобы признать: не все созданное мною мне подходит. Какое бы решение я ни принял, не нужно бояться начинать все сначала. Дух всегда направляет меня к наивысшему благу."
Восьмёрка Земли,"стажировка; получение знаний; изучение и применение новых навыков","Даже мастера своего дела постоянно учатся, и я рад возможности углубить и расширить свои познания, найти новое применение своим знаниям. Я осознаю все сделанное и выученное, все те навыки, которыми я овладел, и цели, которых достиг. Теперь настало время найти новое применение моим умениям и повысить свой профессионализм. Неловкость, которая сопутствовала мне-новичку, ушла, теперь я знаю, что делаю. Я уверен в себе и готов работать во всех сферах своей жизни."
Девятка Земли,"дисциплина и самодостаточность; надежные ресурсы; сдержанность и самоконтроль; последний камень в фундаменте","Я знаю, что могу положиться на себя и Духа. В моем распоряжении множество инструментов, я использую свои ресурсы с умом, упрочняя свое благосостояние в материальном мире. Я трудолюбив и дисциплинирован, нацелен на то, чтобы завершить работу, начатую уже давно. Я придерживаюсь своего плана, веря в то, что он осуществляется именно так, как задумал Дух."
Десятка Земли,"изобилие; благополучие; мастеровитость; финансовая безопасность; унаследованные богатства и знания","Теперь можно отойти и окинуть взглядом то, что я построил своими руками и упорством. Я заявляю свое право собственности на замки, что воздвигнуты и материализованы мной в реальном мире. Я обрел знания и опыт и стал мастером благодаря всему тому, что пережил. Я улыбаюсь своей доброй удаче."
Паж Земли,"твердое решение процветать; первые признаки, что вам светит успех; неопровержимые доказательства, что ваш упорный труд будет вознагражден; реалистичные замыслы; начало нового дела","Все начинается с планирования, и я вижу удачные результаты. Я деятельная натура и сам принимаю решения. У меня есть возможность притягивать к себе именно то, что мне нужно."
Вестник Земли,"трудолюбивый; честный; преодоление и твердость; разумные и осторожные действия; дотошность; усидчивость; выносливость; решимость","Я готов творить вместе с Духом, действовать качественно и эффективно. Я выкладываюсь по полной и не оставляю дело на полпути. Я полон решимости и целеустремленности и знаю, что мои усилия будут вознаграждены."
Королева Земли,"практичность и приземленность; доверенное лицо; работящий; находчивый; садовник, который ухаживает за посадками","Я целеустремленный, приземленный и ставлю себе четкие цели. Я честен в работе с другими, отдаю себе отчет в том, что мы делаем, и осознаю препятствия, с которыми мы сталкиваемся. Я разумно пользуюсь всеми своими ресурсами, будь это финансы, возможности или люди, готовые мне помочь в моих начинаниях."
Король Земли,"бизнесмен; филантроп; богатство; шедрость; целеполагание; надежный лидер","Я верю в незримое, доверяю ему, и знаю, что оно проявится в материальном мире именно так, как мне нужно. Возможности повсюду. Я готов к тому, чтобы изобилие проявилось в этом мире максимально благоприятным для меня образом. Я воплощаю все свои желания в жизнь, отдавая себе отчет в том, какие ежедневные усилия нужно к этому приложить."
Туз Воды,"безусловная любовь; полное изобилие; плодовитость любви","Я наполнен любовью Духа и радостно делюсь ею с другими людьми, чтобы напоить семена совместного созидания. Любовь дает мне надежду и ярко освещает все возможности. Я верю, что мечта станет реальностью. Мною руководит Дух, он дает мне нужные знания и позволяет вовремя заметить неладное."
